<?xml version="1.0" encoding="UTF-8"?>
<?xml-stylesheet type="text/xsl" href="http://jsbsim.sf.net/JSBSimScript.xsl"?>
<runscript xmlns:xsi="http://www.w3.org/2001/XMLSchema-instance"
    xsi:noNamespaceSchemaLocation="http://jsbsim.sf.net/JSBSimScript.xsd"
    name="sUAS bench static test">
  <description>Simplest of all tests</description>
  <use aircraft="bench_bldc" initialize="reset00"/>
  <run start="0.0" end="1080000" dt="0.004">
  
  <property value="0"> simulation/notify-time-trigger </property>
	<event name="Repeating Notify" persistent="true">
	<description>Output message at 10 second intervals, starting after
		   trimming is completed.
	</description>
	<notify>

  	<property>propulsion/engine/propeller-rpm</property>
  	<property>propulsion/engine[0]/thrust-lbs</property>
	<property>propulsion/engine[0]/prop_torque_ftlbs</property>
	<property>propulsion/engine/power-hp</property>
 
	</notify>
	<condition> simulation/sim-time-sec >= simulation/notify-time-trigger </condition>
	<set name="simulation/notify-time-trigger" value="1" type="FG_DELTA" />
	</event>

	  <event name="Throttle-up">
      <description>Move throttle to full for take-off.</description>
      <condition>simulation/sim-time-sec  ge  10.0</condition>
      <!--<set name="fcs/throttle-cmd-norm[0]" value="1.0" action="FG_RAMP" tc="10.0"/>-->
	  <set name="fcs/throttle-cmd-norm[0]" value="1.0"/>
      </event>

  </run>
</runscript>

